B1: Colaboradores do site Aves do Brasil
C3: 2007
B4: Nome | C4: Jan | D4: Fev | E4: Mar | F4: Abr | G4: Mai | H4: Jun | I4: Jul | J4: Ago | K4: Set | L4: Out | M4: Nov | N4: Dez | O4: Total
B5: Eduardo Assis | C5: =75/12 -> 6.25 | D5: =75/12 -> 6.25 | E5: =75/12 -> 6.25 | F5: =75/12 -> 6.25 | G5: =75/12 -> 6.25 | H5: =75/12 -> 6.25 | I5: =75/12 -> 6.25 | J5: =75/12 -> 6.25 | K5: =75/12 -> 6.25 | L5: =75/12 -> 6.25 | M5: =75/12 -> 6.25 | N5: =75/12 -> 6.25 | O5: =SUM(C5:N5) -> 75
B6: João Quental | C6: =120/12 -> 10 | D6: =120/12 -> 10 | E6: =120/12 -> 10 | F6: =120/12 -> 10 | G6: =120/12 -> 10 | H6: =120/12 -> 10 | I6: =120/12 -> 10 | J6: =120/12 -> 10 | K6: =120/12 -> 10 | L6: =120/12 -> 10 | M6: =120/12 -> 10 | N6: =120/12 -> 10 | O6: =SUM(C6:N6) -> 120
B7: Júlio C. Magro | C7: 50 | O7: =SUM(C7:N7) -> 50
B8: Luiz Carlos | C8: =120/12 -> 10 | D8: =120/12 -> 10 | E8: =120/12 -> 10 | F8: =120/12 -> 10 | G8: =120/12 -> 10 | H8: =120/12 -> 10 | I8: =120/12 -> 10 | J8: =120/12 -> 10 | K8: =120/12 -> 10 | L8: =120/12 -> 10 | M8: =120/12 -> 10 | N8: =120/12 -> 10 | O8: =SUM(C8:N8) -> 120
B9: Marcello Villar Boock | C9: 10 | O9: =SUM(C9:N9) -> 10